{
  "schema_version": "1.2",
  "registry_version": "0.3.0",
  "work_package": "WP1",
  "status": "open_blocked_external_determinations",
  "last_reviewed": "2026-07-29",
  "earned_claim_level": "G0_component_verified_synthetic_only",
  "participant_evidence_level": "none",
  "determination_scope": {
    "manifest_version": "1.1",
    "protocol_id": "NRLIS-T001",
    "protocol_version": "0.3",
    "document_paths": [
      "GrossTree/__init__/PROJECT_CHARTER.md",
      "GrossTree/__init__/WP1_GOVERNANCE_AND_DETERMINATION_PLAN.md",
      "GrossTree/__init__/EVALUATION_SAFETY_GOVERNANCE.md",
      "GrossTree/Basic/Trials/NRLIS-T001/PROTOCOL.md",
      "GrossTree/Basic/Trials/NRLIS-T001/ACCESSIBLE_CONSENT_ASSENT_DISSENT_PLAN.md",
      "GrossTree/Basic/Trials/NRLIS-T001/TASK_REFERENCE_AUTHORSHIP_SOP.md",
      "GrossTree/Basic/Training/Dataset/DATA_CONTRACT.md",
      "GrossTree/Basic/Training/Dataset/DATA_MANAGEMENT_WITHDRAWAL_PLAN.md",
      "GrossTree/Basic/Training/Evaluation/METRICS.md",
      "GrossTree/Basic/Training/Evaluation/T001_ANALYSIS_SPEC.md"
    ],
    "scope_sha256": null
  },
  "authorizations": {
    "research_contact": false,
    "pre_consent_access_check": false,
    "enrollment": false,
    "participant_facing_intake": false,
    "non_recorded_capability_assessment": false,
    "audio_recording": false,
    "video_recording": false,
    "raw_gaze_recording": false,
    "derived_gaze_collection": false,
    "historical_media_ingest": false,
    "participant_data_training": false,
    "participant_specific_inference": false,
    "shadow_inference": false,
    "candidate_reveal": false,
    "voice_clone_training": false,
    "voice_rendering": false,
    "message_transmission": false,
    "demonstration": false,
    "publication_examples": false,
    "external_data_sharing": false,
    "future_secondary_use": false
  },
  "consent_scopes": {
    "research_contact": "not_authorized",
    "pre_consent_access_check": "not_authorized",
    "enrollment": "not_authorized",
    "participant_facing_intake": "not_authorized",
    "non_recorded_capability_assessment": "not_authorized",
    "audio_recording": "not_authorized",
    "video_recording": "not_authorized",
    "raw_gaze_recording": "not_authorized",
    "derived_gaze_collection": "not_authorized",
    "historical_media_ingest": "not_authorized",
    "participant_data_training": "not_authorized",
    "participant_specific_inference": "not_authorized",
    "shadow_inference": "not_authorized",
    "candidate_reveal": "not_authorized",
    "voice_clone_training": "not_authorized",
    "voice_rendering": "not_authorized",
    "message_transmission": "not_authorized",
    "demonstration": "not_authorized",
    "publication_examples": "not_authorized",
    "external_data_sharing": "not_authorized",
    "future_secondary_use": "not_authorized"
  },
  "external_authorities": [],
  "external_evidence_records": [],
  "training_records": [],
  "roles": [
    {
      "role_id": "ROLE-ACCOUNTABLE-INVESTIGATOR",
      "status": "unassigned",
      "holder_id": null,
      "appointment_record_id": null,
      "training_record_ids": [],
      "required_training_types": [
        "human_research_protection",
        "protocol_accountability",
        "conflict_of_interest"
      ],
      "independence_required": false,
      "independence_record_id": null,
      "must_be_distinct_from_role_ids": [],
      "combination_approval_record_id": null,
      "expires_on": null
    },
    {
      "role_id": "ROLE-ETHICS-CONTACT",
      "status": "unassigned",
      "holder_id": null,
      "appointment_record_id": null,
      "training_record_ids": [],
      "required_training_types": [
        "human_research_protection",
        "institutional_ethics_process"
      ],
      "independence_required": true,
      "independence_record_id": null,
      "must_be_distinct_from_role_ids": [
        "ROLE-TECHNICAL-LEAD"
      ],
      "combination_approval_record_id": null,
      "expires_on": null
    },
    {
      "role_id": "ROLE-CONSENT-ACCESS-REVIEWER",
      "status": "unassigned",
      "holder_id": null,
      "appointment_record_id": null,
      "training_record_ids": [],
      "required_training_types": [
        "human_research_protection",
        "accessible_consent_and_capacity",
        "conflict_of_interest"
      ],
      "independence_required": true,
      "independence_record_id": null,
      "must_be_distinct_from_role_ids": [
        "ROLE-ACCOUNTABLE-INVESTIGATOR",
        "ROLE-TECHNICAL-LEAD"
      ],
      "combination_approval_record_id": null,
      "expires_on": null
    },
    {
      "role_id": "ROLE-SLP-CLINICAL-COLLABORATOR",
      "status": "unassigned",
      "holder_id": null,
      "appointment_record_id": null,
      "training_record_ids": [],
      "required_training_types": [
        "human_research_protection",
        "accessible_communication_and_aac",
        "participant_safety"
      ],
      "independence_required": true,
      "independence_record_id": null,
      "must_be_distinct_from_role_ids": [
        "ROLE-TECHNICAL-LEAD"
      ],
      "combination_approval_record_id": null,
      "expires_on": null
    },
    {
      "role_id": "ROLE-TECHNICAL-LEAD",
      "status": "unassigned",
      "holder_id": null,
      "appointment_record_id": null,
      "training_record_ids": [],
      "required_training_types": [
        "human_research_protection",
        "privacy_data_security",
        "authorship_and_output_safety"
      ],
      "independence_required": false,
      "independence_record_id": null,
      "must_be_distinct_from_role_ids": [],
      "combination_approval_record_id": null,
      "expires_on": null
    },
    {
      "role_id": "ROLE-DATA-STEWARD",
      "status": "unassigned",
      "holder_id": null,
      "appointment_record_id": null,
      "training_record_ids": [],
      "required_training_types": [
        "human_research_protection",
        "privacy_data_security",
        "incident_response"
      ],
      "independence_required": true,
      "independence_record_id": null,
      "must_be_distinct_from_role_ids": [
        "ROLE-TECHNICAL-LEAD"
      ],
      "combination_approval_record_id": null,
      "expires_on": null
    },
    {
      "role_id": "ROLE-INDEPENDENT-EVENT-REVIEWER",
      "status": "unassigned",
      "holder_id": null,
      "appointment_record_id": null,
      "training_record_ids": [],
      "required_training_types": [
        "human_research_protection",
        "adverse_event_and_authorship_review",
        "conflict_of_interest"
      ],
      "independence_required": true,
      "independence_record_id": null,
      "must_be_distinct_from_role_ids": [
        "ROLE-ACCOUNTABLE-INVESTIGATOR",
        "ROLE-TECHNICAL-LEAD"
      ],
      "combination_approval_record_id": null,
      "expires_on": null
    }
  ],
  "gates": [
    {
      "gate_id": "WP1-G01",
      "domain": "applicability",
      "requirement": "Scoped determinations from all applicable institutions or authorities",
      "status": "unresolved",
      "evidence_record_ids": [],
      "recorded_by_role_id": null,
      "recorded_by_holder_id": null,
      "issuing_authority_ids": [],
      "decided_on": null,
      "review_due_on": null,
      "expires_on": null,
      "notes": "NRLIS project rule requires an external record; Cornell separately requires IRB-staff determination if Cornell governs."
    },
    {
      "gate_id": "WP1-G02",
      "domain": "applicability",
      "requirement": "All institutional engagement and accountable offices identified, subject to documented reliance",
      "status": "unresolved",
      "evidence_record_ids": [],
      "recorded_by_role_id": null,
      "recorded_by_holder_id": null,
      "issuing_authority_ids": [],
      "decided_on": null,
      "review_due_on": null,
      "expires_on": null,
      "notes": "All potentially applicable institutions remain unresolved; a documented reliance or authorization agreement may designate one reviewing IRB without erasing other obligations."
    },
    {
      "gate_id": "WP1-G03",
      "domain": "applicability",
      "requirement": "Sites, jurisdictions, and cross-border rules determined",
      "status": "unresolved",
      "evidence_record_ids": [],
      "recorded_by_role_id": null,
      "recorded_by_holder_id": null,
      "issuing_authority_ids": [],
      "decided_on": null,
      "review_due_on": null,
      "expires_on": null,
      "notes": "Participant, investigator, storage, and analysis locations are not registered."
    },
    {
      "gate_id": "WP1-G04",
      "domain": "applicability",
      "requirement": "Device software and FDA or IDE applicability determined",
      "status": "unresolved",
      "evidence_record_ids": [],
      "recorded_by_role_id": null,
      "recorded_by_holder_id": null,
      "issuing_authority_ids": [],
      "decided_on": null,
      "review_due_on": null,
      "expires_on": null,
      "notes": "No medical-device or investigational-device conclusion is claimed."
    },
    {
      "gate_id": "WP1-G05",
      "domain": "applicability",
      "requirement": "HIPAA, health-data, and vendor-role applicability determined",
      "status": "unresolved",
      "evidence_record_ids": [],
      "recorded_by_role_id": null,
      "recorded_by_holder_id": null,
      "issuing_authority_ids": [],
      "decided_on": null,
      "review_due_on": null,
      "expires_on": null,
      "notes": "Project privacy controls apply even if HIPAA is not applicable."
    },
    {
      "gate_id": "WP1-G06",
      "domain": "research_care_boundary",
      "requirement": "Research, family assistance, and clinical care boundaries approved",
      "status": "in_progress",
      "evidence_record_ids": [],
      "recorded_by_role_id": null,
      "recorded_by_holder_id": null,
      "issuing_authority_ids": [],
      "decided_on": null,
      "review_due_on": null,
      "expires_on": null,